{"apiVersion":"edgeai.stream-checkpoint/v1","executionSha256":"aaaaaaaaaaaaaaaaaaaaaaaaaaaaaaaaaaaaaaaaaaaaaaaaaaaaaaaaaaaaaaaa","manifest":{"inputs":[{"generation":1,"producer":{"deviceId":"cccccccc-cccc-4ccc-8ccc-cccccccccccc","epoch":1,"kind":"DEVICE_SESSION","sessionId":"aaaaaaaa-aaaa-4aaa-8aaa-aaaaaaaaaaaa"},"routeId":"11111111-1111-4111-8111-111111111111"},{"generation":2,"producer":{"deviceId":"dddddddd-dddd-4ddd-8ddd-dddddddddddd","epoch":2,"kind":"DEVICE_SESSION","sessionId":"bbbbbbbb-bbbb-4bbb-8bbb-bbbbbbbbbbbb"},"routeId":"22222222-2222-4222-8222-222222222222"}],"limits":{"max_buffer_bytes":16777216,"max_frames":128,"max_state_bytes":262144},"outputs":[{"generation":3,"producer":{"attemptId":"eeeeeeee-eeee-4eee-8eee-eeeeeeeeeeee","epoch":3,"kind":"TASK_ATTEMPT"},"routeId":"33333333-3333-4333-8333-333333333333"}],"version":1},"revision":1,"routes":[{"committed":1,"ended":false,"frames":[],"received":1,"routeId":"11111111-1111-4111-8111-111111111111"},{"committed":1,"ended":false,"frames":[],"received":1,"routeId":"22222222-2222-4222-8222-222222222222"},{"committed":0,"ended":false,"frames":[{"apiVersion":"edgeai.stream/v1","generation":3,"kind":"DATA","mediaType":"application/json","payloadBase64":"OQ==","producer":{"attemptId":"eeeeeeee-eeee-4eee-8eee-eeeeeeeeeeee","epoch":3,"kind":"TASK_ATTEMPT"},"routeId":"33333333-3333-4333-8333-333333333333","sequence":1,"sha256":"19581e27de7ced00ff1ce50b2047e7a567c76b1cbaebabe5ef03f7c3017bb5b7"}],"received":1,"routeId":"33333333-3333-4333-8333-333333333333"}],"serial":3,"stateBase64":"OQ=="}